{
  "authority_claim": false,
  "command": [
    "uv",
    "run",
    "python",
    "-B",
    "Iris/validation/residual_refactor/write_evidence_manifest.py"
  ],
  "created_at": "2026-08-02T23:39:18.611979+00:00",
  "inputs": [],
  "mutable": false,
  "outputs": [
    {
      "exists": true,
      "path": "Iris/_docs/refactor/residual_refactor/clean_checkout_binding_report.json",
      "sha256": "ae8de76dbe4ec51b65a73698b27beced90e4fcf6093cdc11c140535e352334aa"
    }
  ],
  "producer": "clean_checkout_binding_adapter",
  "producer_readpoint": "Iris/validation/clean_checkout/run_iris_clean_checkout_validation.py",
  "role": "current",
  "schema_version": "iris-residual-evidence-role-v1",
  "subject": {
    "commit": "4f3699929ba838bf5b6a26f5924b3ee9d7066dff",
    "overlay_sha256_or_null": null,
    "tree": "799728a148ab049f96f66c9761203b8d9ef746c3"
  },
  "supersedes": []
}
